{
  "schema_version": 1,
  "project_id": "11111111-1111-4111-8111-111111111111",
  "title": "项目资料整合示例",
  "summary": "一个仅用于验收的合成项目：把代码、参考论文、分析、实验与成果放在同一份可读总览中，原资料仍各归其主。",
  "language": "zh",
  "entries": [
    {
      "entry_id": "code",
      "kind": "code",
      "title": "示例代码",
      "purpose": "说明该项目的代码入口；本次不运行代码。",
      "ref": {"kind": "project-file", "relative_path": "src/example.py"}
    },
    {
      "entry_id": "paper",
      "kind": "paper",
      "title": "合成参考论文",
      "purpose": "说明外部论文如何被引用；这不是正式文库中的论文。",
      "ref": {"kind": "external-resource", "provider": "zotero", "resource_id": "synthetic-paper-only", "uri": null}
    },
    {
      "entry_id": "analysis",
      "kind": "analysis",
      "title": "示例分析",
      "purpose": "连接已有分析材料；不是重新生成论文分析。",
      "ref": {"kind": "project-file", "relative_path": "docs/analysis.md"}
    },
    {
      "entry_id": "note",
      "kind": "note",
      "title": "设计笔记",
      "purpose": "保留项目选择与尚未解决的问题。",
      "ref": {"kind": "project-file", "relative_path": "docs/design.md"}
    },
    {
      "entry_id": "experiment",
      "kind": "experiment",
      "title": "合成实验记录",
      "purpose": "说明实验资料的入口；不宣称已运行或验证实验。",
      "ref": {"kind": "project-file", "relative_path": "experiments/demo/report.md"}
    },
    {
      "entry_id": "result",
      "kind": "result",
      "title": "合成结果说明",
      "purpose": "连接结果解读；其中没有真实测量值。",
      "ref": {"kind": "project-file", "relative_path": "reports/demo-result.md"}
    },
    {
      "entry_id": "missing",
      "kind": "other",
      "title": "尚缺的复现实录",
      "purpose": "验证缺失资料仍被清楚列出，而不是静默消失。",
      "ref": {"kind": "project-file", "relative_path": "docs/not-created.md"}
    }
  ]
}
