{
  "schema_version": 1,
  "project_id": "77777777-7777-4777-8777-777777777771",
  "title": "Synthetic complete-inline project",
  "summary": "Handwritten project-entry input; no experiment execution, registration or reader check.",
  "language": "en",
  "entries": [
    {
      "entry_id": "code-main",
      "kind": "code",
      "title": "Input assembly",
      "purpose": "Selected static source; inspect only.",
      "ref": {
        "kind": "project-file",
        "relative_path": "src/main.py"
      }
    },
    {
      "entry_id": "code-prepare",
      "kind": "code",
      "title": "Preparation helper",
      "purpose": "Selected static source; no execution proof.",
      "ref": {
        "kind": "project-file",
        "relative_path": "src/prepare.py"
      }
    },
    {
      "entry_id": "config",
      "kind": "other",
      "title": "Selected configuration",
      "purpose": "Explicit synthetic configuration.",
      "ref": {
        "kind": "project-file",
        "relative_path": "config.json"
      }
    },
    {
      "entry_id": "paper-source",
      "kind": "paper",
      "title": "Synthetic alpha source note",
      "purpose": "Qualified Source 88888888-8888-4888-8888-888888888881; declared source note, not a registered or reader-verified owner.",
      "ref": {
        "kind": "external-resource",
        "provider": "obsidian",
        "resource_id": "resource:fixture:alpha",
        "uri": null
      }
    },
    {
      "entry_id": "paper-analysis",
      "kind": "analysis",
      "title": "Synthetic alpha analysis note",
      "purpose": "Qualified Source 88888888-8888-4888-8888-888888888881; existing navigation input, not certified scientific analysis.",
      "ref": {
        "kind": "external-resource",
        "provider": "obsidian",
        "resource_id": "analysis:fixture:alpha",
        "uri": null
      }
    },
    {
      "entry_id": "paper-canvas",
      "kind": "other",
      "title": "Synthetic alpha editable Canvas",
      "purpose": "Qualified Source 88888888-8888-4888-8888-888888888881; native editable navigation input; reader not queried.",
      "ref": {
        "kind": "external-resource",
        "provider": "obsidian",
        "resource_id": "canvas:fixture:alpha",
        "uri": null
      }
    }
  ]
}
