{
  "schema_version": 1,
  "project_id": "77777777-7777-4777-8777-777777777772",
  "title": "Synthetic sparse-external-plan project",
  "summary": "Handwritten project-entry input; no experiment execution, registration or reader check.",
  "language": "en",
  "entries": [
    {
      "entry_id": "code-main",
      "kind": "code",
      "title": "Input assembly",
      "purpose": "Selected static source; inspect only.",
      "ref": {
        "kind": "project-file",
        "relative_path": "src/main.py"
      }
    },
    {
      "entry_id": "code-prepare",
      "kind": "code",
      "title": "Preparation helper",
      "purpose": "Selected static source; no execution proof.",
      "ref": {
        "kind": "project-file",
        "relative_path": "src/prepare.py"
      }
    },
    {
      "entry_id": "config",
      "kind": "other",
      "title": "Selected configuration",
      "purpose": "The selected benchmark file is deliberately missing.",
      "ref": {
        "kind": "project-file",
        "relative_path": "configs/benchmark.json"
      }
    },
    {
      "entry_id": "paper-source",
      "kind": "paper",
      "title": "Synthetic beta source note",
      "purpose": "Qualified Source 88888888-8888-4888-8888-888888888882; declared source note, not a registered or reader-verified owner.",
      "ref": {
        "kind": "external-resource",
        "provider": "obsidian",
        "resource_id": "resource:fixture:beta",
        "uri": null
      }
    },
    {
      "entry_id": "paper-analysis",
      "kind": "analysis",
      "title": "Synthetic beta analysis note",
      "purpose": "Qualified Source 88888888-8888-4888-8888-888888888882; existing navigation input, not certified scientific analysis.",
      "ref": {
        "kind": "external-resource",
        "provider": "obsidian",
        "resource_id": "analysis:fixture:beta",
        "uri": null
      }
    },
    {
      "entry_id": "paper-canvas",
      "kind": "other",
      "title": "Synthetic beta editable Canvas",
      "purpose": "Qualified Source 88888888-8888-4888-8888-888888888882; declared target is deliberately missing.",
      "ref": {
        "kind": "external-resource",
        "provider": "obsidian",
        "resource_id": "canvas:fixture:beta",
        "uri": null
      }
    }
  ]
}
